Id,Address,Price,Size,Property Type,Agency Name,Agent Name,Description,Property Link,Date Posted,Latitude,Longitude
6983272,"2.04 Newark Works, Lower Bristol Road, Bath, Somerset, BA2 3DQ",ROA,"1,047 Sq Ft","Office, Offices",CSquared (Previously Colston & Colston Chartered Surveyors),Allan Lloyd,"Unit 2.04 is situated on the ground floor, next to Mokoko at Newark Works with access directly from the promenade making it self-contained. The suite benefits from double-height ceilings, a functional floorplate, fantastic levels of natural light, and features natural airflow. The unit has a solid concrete floor, exposed services including electricity ports and gas radiators, suspended dimmable LED strip lighting, double-glazed Crittall windows, and exposed steel beams.The communal kitchen and breakout space is located in the Crain Hall which acts as the site's community hub where a variety of breakout spaces can be found including a kitchen island, sofas, dining tables, and spaces for informal meetings. Formal meeting space is provided, the building has 2x 6-person meeting rooms and 2x 12-person meeting rooms.Kitchen essentials are provided along with fridges, freezers, ice machines, tea, coffee, dog biscuits, and more.Showers and lockers are located on the ground floor. W/c facilities can be found throughout the property on all floors.Newark Works holds a variety of social events throughout the month and occupiers are welcome to hold their own events at the premises also.Newark Works is the only remaining 19th century works of the highly significant engineering firm, Stothert  and  Pitt.The development will retain much of the character of the building; set to provide unique and iconic industrial style workspaces.Newark Works is the only remaining 19th century works of the highly significant engineering firm, Stothert  and  Pitt, once the cities principle employer.The development will retain much of the character of the building; set to provide unique and iconic industrial style workspaces.The huge halls and high ceilings, exposed brickwork and industrial steel, combine to provide a dramatic working environment, to provide a creative hub for forward thinkers, thought leaders and entrepreneurs.It is a dynamic and vibrant destination at the heart of the fast-evolving Bath Quays business district, within the new Bath Enterprise Zone. This is a home for single entrepreneurs, burgeoning creative businesses and well-established companies alike.Follow the link for a 3D walk through of the development and to see the available space: https://my.matterport.com/show/?m=t8MsouEWgD6 ( Agency Pilot Software ref: 558 )",https://propertylink.estatesgazette.com/property-details/6983272-2-04-newark-works-lower-bristol-road-bath-somerset-ba2-3dq,16th October 2024,51.3781761,-2.363818
6938574,"18-18a Monmouth Place, Bath, Bath And North East Somerset, BA1 2AY","£45,000.00  Per  Annum","2,031 Sq Ft","Office, Offices",CSquared (Previously Colston & Colston Chartered Surveyors),Emily Dagg,"DescriptionThe property comprises newly refurbished office accommodation at ground and first floor levels of a Grade II Listed building with Class E use consent. The current configuration provides a reception office, meeting room, storage room, kitchen and two WC's off a lobby area at ground floor and office use at first floor and mezzanine level (from first floor).There is a steel spiral staircase to the rear of the ground floor which provides access to the first floor and up to the mezzanine.The rooms at first floor benefit from good levels of natural light from font and rear windows and a number of skylights.LocationBath is a city renowned for its attractive architecture, unique retail offering  and  world heritage status. Bath and North-East Somerset has a residential population of 193,400 and annual visitor numbers exceeding 6 million, according to the last Visitor Impact Report 2018. Bath is served by excellent transport infrastructure, junction 18 of the M4 being just 10 miles to the north via the A46. Train journeys to Bristol are just 12 minutes, with travel to London Paddington approximately 1 hour 20 minutes.SituationThe property is situated on the Northern side of Monmouth Place in central Bath, which connects the A367 junction (Charles Street/Queen Square and Monmouth Street) with the A4 Upper Bristol Road.Nearby occupiers include The Scallop Shell, The Bath Distillery, Wentworth Estate Agents, Chapel Row Beauty Rooms and Corkage.Accommodation TextWe understand the net internal floor areas are as follows: -Ground Floor - 73.6 Sq M (792.2 Sq Ft)First Floor - 101.3 Sq M (1,090.4 Sq Ft)Mezzanine - 13.8 Sq M (148.5 Sq Ft)Total - 118.7 Sq M (2,031.1 Sq Ft)Business RatesRateable Value (April 2023) - £40,250UBR(23/24) - 0.512Rates Payable (April 2023) - £20,608Rates payable subject to small business rate relief eligibility.We recommend any interested parties make their own enquiries to Bath  and  North East Somerset Council (01225 477000) to verify these figures.Legal CostsEach party is to be responsible for their own legal and professional fees incurred in any transaction.Service Charge DetailsThe tenant will be expected to contribute to a fair and reasonable proportion of the landlord's costs in the upkeep, repair and maintenance of the building. Further details provided upon request.Further InformationViewings can be arranged through the joint agents,CSquared -Allan LloydNathan ClarkEmily DaggDerek Walker -Hugh Warren( Agency Pilot Software ref: 686 )",https://propertylink.estatesgazette.com/property-details/6938574-18-18a-monmouth-place-bath-bath-and-north-east-somerset-ba1-2ay,8th July 2024,51.3830505,-2.3664144
6964228,"First Floor Offices, Bath Cricket Club, North Parade, Bath","£40,500.00  Per  Annum","1,620 Sq Ft","Office, Offices",Carter Jonas LLP,Philip Marshall,"DescriptionOpen Plan Quality Offices / StudioNewley built, the offices provide open plan offices at 1st floor level, on the southern corner of a recent development, overlooking the pitch. The offices are accessed via a shared, ground floor entrance with the Club, which the Club will maintain to a high standard. The offices, currently without WC or Kitchenette, will be finished to an agreed specification by the club, for the tenant.One or two parking spaces may be available by separate negotiation.LocationBath is an internationally recognised city, located approximately 100 miles west of London and 13 miles east of Bristol. It is set within a built environment of the highest quality, with a residential population of over 80,000 and annual visitor numbers exceeding 4 million at the last Census. Bath Cricket Club is situated immediately to the south of North Parade Bridge, in the heart of Bath City Centre. It is a short walk from Bath Spa Railway Station, Bath's famous retail centre, and many other local facilities. It is also close to bus routes to and from the city and, although not within an office area, the offices will face the greenery of the cricket pitch and have a pleasant outlook, whilst being close to central facilities.Bullet Points 1Quality Open Plan SpaceBullet Points 2Air Conditioned, 'B' EPC ratingBullet Points 3City Centre LocationEPCIt has been assessed as EPC 'B'.( Agency Pilot Software ref: 20016037 )",https://propertylink.estatesgazette.com/property-details/6964228-first-floor-offices-bath-cricket-club-north-parade-bath,5th June 2024,51.3799994,-2.3527256
6976873,"Second Floor, 25 Windsor Castle, Upper Bristol Road, Bath, Bath and North East Somerset, BA1 3DN","£17,500.00  Per  Annum","1,032 Sq Ft","Office, Offices",CSquared (Previously Colston & Colston Chartered Surveyors),Maddie Pyles,SECOND FLOOR OPEN PLAN OFFICE WITH PARKING TO LET( Agency Pilot Software ref: 832 ),https://propertylink.estatesgazette.com/property-details/6976873-second-floor-25-windsor-castle-upper-bristol-road-bath-bath-and-north-east-somerset-ba1-3dn,28th October 2024,51.3842868,-2.381915
6966942,"32 Milsom Street, Bath, BA1 1DG","£40,000.00  Per  Annum",765 Sq Ft,"General Retail, Retail - High Street, Retail",Avison Young - Retail,Chris Wright,"SummaryRetail / High Street Retail To Let, BathDescriptionQuoting Rent - £40,000 pa - Prominently situated towards the top of Milsom Street - Grade II Listed Building.The City of Bath is a World Heritage Site attracting approximately 5.8m tourists per year with an established visitor spend in excess of £350m.The premises are prominently situated towards the top of Milsom Street, adjacent to Suave Owl, opposite HMV and close to Reiss, Vinegar Hill, Bravissimo, Savills, OKA and House of Fraser (Jollys).Local AuthorityBath and North East Somerset",https://propertylink.estatesgazette.com/property-details/6966942-32-milsom-street-ba1,3rd July 2024,51.3843428,-2.3614528
6624703,"Riverside South Building, Walcot Street, Bath, Bath And North East Somerset","£67,000.00  Per  Annum","2,783 Sq Ft","Office, Offices",Carter Jonas LLP,Philip Marshall,"ONE FLOOR REMAININGThe property comprises office suites arranged over the first and second floors. Both suites are predominately open plan, with some partitioning to provide meeting facilities. Each suit also benefits form having its own kitchen and toilet facilities .The property was recently refurbished and have been finished to a modern standard and include Cat II fluorescent lighting as well as Air Conditioning.Bath is an internationally recognise city, located approximnately 100 miles west of London and 13 miles east of Bristol. It is set within a built environment of the highest quality with a residential population of over 80,000 and annual visitor numbers exceeding 4 million at the last Census.Walcot and Walcot Street form one of the main gateways into Bsth and the area has retained its own individual character despite being within a few minutes' walk of the city centre. Bath Spa station provides links to Bristol Temple Meads (from 12 minutes) and links to London Paddington (from 84 minutes).High Quality Open Plan Office SpaceGood Local Transport LinksCity Centre LocationAir Conditioning ( Agency Pilot Software ref: 20010938 )",https://propertylink.estatesgazette.com/property-details/6624703-riverside-south-building-walcot-street-bath-bath-and-north-east-somerset,15th October 2024,51.388297,-2.359127
6404227,"Kings Court Parsonage Lane, Bath, Bath And North East Somerset, BA1",ROA,"5,687 - 17,007 Sq Ft","Office, Offices",Carter Jonas LLP,Philip Marshall,High Quality Open Plan Refurbished Offices To Let in Central Bath( Agency Pilot Software ref: 20009869 ),https://propertylink.estatesgazette.com/property-details/6404227-kings-court-parsonage-lane-bath-bath-and-north-east-somerset-ba1,11th April 2024,51.381907,-2.3611175
6926540,"Open Storage, The Old Fuller Earth Works, Fosseway Environment Park, Bath, Somerset",£2.50   Per Sq Ft,0.5 - 4 Acres,"General Industrial, Land, Industrial, Commercial Land",Carter Jonas LLP,Alison Williams,Open Storage OpportunitiesStorage yard areas from 0.5 - 4 acres with flat concrete surface. The site is secure with access being via security gates.The storage yards are accessed directly from the A367.The property is conveniently located just off the A367 approximately 2.5 miles from Bath City Centre.Hard StandingSecure SiteCovered Storage AvailableYards Available from 0.5 acresThe yard areas are currently used for open storage.  Prospective tenants should satisfy themselves in respect of the planning they require for their intended occupation.Local Authority Bath and North East SomersetEmail: council_connect@bathnes.gov.ukTel: 01225 394041As the property comprises open storage  an EPC will not be  required.  ( Agency Pilot Software ref: 20014252 ),https://propertylink.estatesgazette.com/property-details/6926540-open-storage-the-old-fuller-earth-works-fosseway-environment-park-bath-somerset,11th April 2024,51.3490304,-2.3900503
6778017,"The Old Fuller Earth Works, The Firs, Combe Hay, Bath, Somerset, BA2","£17,500.00  Per  Annum","1,274 Sq Ft","Office, Offices",Carter Jonas LLP,Maddie Pyles,The property comprises of first floor office space which will have its own separate entrance. The first floor is open plan. There is also a car park to the rear of the property which the tenant will have access to.Toilets will be constructed shortly.( Agency Pilot Software ref: 20012429 ),https://propertylink.estatesgazette.com/property-details/6778017-the-old-fuller-earth-works-the-firs-combe-hay-bath-somerset-ba2,11th April 2024,51.3492492,-2.3914026
6985097,"2.05 Newark Works, Lower Bristol Road, Bath, Somerset, BA2 3DQ",ROA,"1,081 Sq Ft","Office, Offices",CSquared (Previously Colston & Colston Chartered Surveyors),Allan Lloyd,"Unit 2.05 is situated on the ground floor, next to Mokoko Coffee at Newark Works with access directly from the exterior of the building. The suite benefits from double-height ceilings, a functional floorplate, fantastic levels of natural light, and features natural airflow. The unit has a solid concrete floor, exposed services including electricity ports and gas radiators, suspended dimmable LED strip lighting, Crittall windows and exposed beams.The communal kitchen and breakout space is located in the Crain Hall which acts as the site's community hub where a variety of breakout spaces can be found including a kitchen island, sofas, dining tables, and spaces for informal meetings. Formal meeting space is provided, the building has 2x 6-person meeting rooms and 2x 12-person meeting rooms.Kitchen essentials are provided along with fridges, freezers, ice machines, tea, coffee, dog biscuits, and more.Showers and lockers are located on the ground floor. W/c facilities can be found throughout the property on all floors.Newark Works holds a variety of social events throughout the month and occupiers are welcome to hold their own events at the premises also.Newark Works is the only remaining 19th century works of the highly significant engineering firm, Stothert  and  Pitt, once the cities principle employer.The development will retain much of the character of the building; set to provide unique and iconic industrial style workspaces.The huge halls and high ceilings, exposed brickwork and industrial steel, combine to provide a dramatic working environment, to provide a creative hub for forward thinkers, thought leaders and entrepreneurs.It is a dynamic and vibrant destination at the heart of the fast-evolving Bath Quays business district, within the new Bath Enterprise Zone. This is a home for single entrepreneurs, burgeoning creative businesses and well-established companies alike.Follow the link for a 3D walk through of the development and to see the available space: https://my.matterport.com/show/?m=t8MsouEWgD6 ( Agency Pilot Software ref: 651 )",https://propertylink.estatesgazette.com/property-details/6985097-2-05-newark-works-lower-bristol-road-bath-somerset-ba2-3dq,16th October 2024,51.3781761,-2.363818
6979304,"Ground Floor Of 6 Westgate Buildings, Bath, Bath, Somerset","£50,000.00  Per  Annum","1,012 Sq Ft","General Retail, Retail",Carter Jonas LLP,Tim Brooksbank,"The property is arranged over ground floor only and consists of open plan sales space fronting onto Westgate Buildings. There is additional ancillary space to the side of the sales area at a slightly raised level. The premises are currently in a stripped back condition and will require the installation of a W/C and kitchen. There is scope to install a small extractor fan at ground floor level, subject to the right statutory consents being granted.Westgate Buildings is situated just off the popular Kingsmead Square, which is an attractive location within the heart of Bath providing good access to the Theatre Royal and the City's core retail zone. The surrounding area has a mixture of retailers, restaurateurs and cafe operators including Tesco Express and Sports Direct.The Kingsmead Leisure Centre is also within close proximity and holds the Odeon cinema, Premier Inn and JD Weatherspoon's. Kingsmead Square located nearby is a popular destination with a mixture of uses including offices and local independent retailers. 6 Westgate Buildings also benefits from a bus stop outside.The EPC will be made available to interested parties on application.( Agency Pilot Software ref: 20016188 )",https://propertylink.estatesgazette.com/property-details/6979304-ground-floor-of-6-westgate-buildings-bath-bath-somerset,11th September 2024,51.382513,-2.381934
6960247,"25 Queen Square, Bath, Bath And North East Somerset, BA1 2HX",ROA,"627 - 4,150 Sq Ft","Office, Offices",CSquared (Previously Colston & Colston Chartered Surveyors),Emily Dagg,"DescriptionThe property comprises office suites spread over five floors of a Palladian Neo Classical, Grade I Listed Building. Internally, the offices are well proportioned and in good condition, benefitting from original period features and large sash windows overlooking Queens Square. Access to the property is through a secure, communal lobby and stairwell. There are shared kitchen and WC facilities.Parking is available by way of separate negotiation.LocationBath is a city renowned for its attractive architecture, unique retail offering  and  world heritage status. Bath and North-East Somerset has a residential population of 193,400 and annual visitor numbers exceeding 6 million, according to the last Visitor Impact Report 2018. Bath is served by excellent transport infrastructure, junction 18 of the M4 being just 10 miles to the north via the A46. Train journeys to Bristol are just 12 minutes, with travel to London Paddington approximately 1 hour 20 minutes.SituationThe property is located on the Northern side of Queen Square, which is generally regarded as Bath's premier professional office location and is home to many of the City's accountancy, financial, legal and property firms. Charlotte Street car park with approximately 1200 spaces is only a few minutes' walk.Accommodation TextThe property benefits from the following Net Internal Floor Areas:-Lower Ground Floor - 73.46Sq M (791Sq Ft)Ground Floor - 88.35Sq M (951Sq Ft)First Floor - 98.30Sq M (1,058Sq Ft)Second Floor - 58.21Sq M (627Sq Ft)Third Floor - 67.20Sq M (723Sq Ft)Total - 385.52Sq M (4,150Sq Ft)Business RatesRates payable subject to small business rate relief eligibility.Lower Ground Floor OfficeRateable Value (April 2023) £8,700UBR(23/24) 0.499Rates Payable (April 2023) £4,341Ground Floor OfficeRateable Value (April 2023) £21,250UBR(23/24) 0.499Rates Payable (April 2023) £10,604First Floor OfficeRateable Value (April 2023) £24,500UBR(23/24) 0.499Rates Payable (April 2023) £12,226Second Floor OfficeRateable Value (April 2023) £10,500UBR(23/24) 0.499Rates Payable (April 2023) £5,240Third Floor OfficeRateable Value (April 2023) £9,900UBR(23/24) 0.499Rates Payable (April 2023) £4,940We recommend any interested parties make their own enquiries to Bath  and  North East Somerset Council (01225 477000) to verify these figures.Legal CostsEach party is to be responsible for their own legal and professional fees incurred in any transaction.Further InformationFor further information or to arrange a viewing please contact the sole agents at CSquared,Allan LloydM 07527 388036E allan.lloyd@cs-re.co.ukEmily DaggM 07398 637345E emily.dagg@cs-re.co.ukMaddie PylesM 07950 765672E maddie.pyles@cs-re.co.ukAmeneties 1Palladian Neo-Classical Grade I Listed propertyAmeneties 2Period Features and Excellent Outlook onto Queens Square  ( Agency Pilot Software ref: 709 )",https://propertylink.estatesgazette.com/property-details/6960247-25-queen-square-bath-bath-and-north-east-somerset-ba1-2hx,8th August 2024,51.3839494,-2.3636339
6975850,"Third Floor, 14 Queen Square, Bath, Bath and North East Somerset","£8,500.00  Per  Annum",,"Office, Offices",Carter Jonas LLP,Philip Marshall,"The property comprises a number of interconnecting offices all at third floor level. The office space benefits from shared WCs, showers and kitchen facilities.The property is situated on the western side of Queen Square in a prominent position on the corner within Bath city centre., next to Chapel Row. The offices are within a 15 minute walk of Bath Spa railway station, the Southgate Shopping Centre and a variety of restaurants, bars and amenities within the city centre.Bath is a UNESCO World Heritage City of international repute with an approximate population of 99,277 (ONS mid-year population estimates 2018). The city is a regional hub for retail and leisure and is one of the United Kingdom's most visited cities in terms of tourist numbers; with two universities and an established business community.Bath Spa train station has direct trains to both Bristol (circa 12 minutes) and London Paddington (circa 1 hour 30 minutes). Bath enjoys good road links to Bristol via the A4, the south coast via the A36 and the M4 Motorway (Junction 18).Prime city centreGrade I Listed Building ( Agency Pilot Software ref: 20016162 )",https://propertylink.estatesgazette.com/property-details/6975850-third-floor-14-queen-square-bath-bath-and-north-east-somerset,23rd October 2024,51.3830661,-2.3643166
6953158,"4th Floor, Cambridge House, Henry Street , Bath , BA1 1JT",ROA,"5,500 Sq Ft","Office, Offices",CSquared (Previously Colston & Colston Chartered Surveyors),Emily Dagg,"DescriptionCambridge House comprises ground and five upper floors. The fourth floor provides an open plan office space benefitting from raised carpet floors, LED and LG7 lighting, suspended ceilings, air conditioning, fitted kitchen, WC and shower facilities.LocationBath is a city renowned for its attractive architecture, unique retail offering  and  world heritage status. Bath and North-East Somerset has a residential population of 193,400 and annual visitor numbers exceeding 6.25 million, according to the last Visitor Impact Report 2018. Bath is served by excellent transport infrastructure, junction 18 of the M4 being just 10 miles to the north via the A46. Train journeys to Bristol are just 12 minutes, with travel to London Paddington approximately 1 hour 20 minutes.SituationThe office is situated on Henry Street, immediately adjacent to Southgate Shopping Centre. Nearby occupiers include Flourish CSR, Wealthtime, Handelsbanken, Marks and Spencers and several other shops, cafes and restaurants.Accommodation TextThe property benefits from the following Net Internal Floor Areas:-4th Floor - 511sq m (5,500sq ft)Measured in accordance with RICS Property Measurement Statement (2nd Ed.) incorporating the RICS Code of Measuring Practice (6th Ed.).Business RatesRateable Value (April 2023) - £115,000UBR(23/24) - 0.546Rates Payable (April 2023) - £62,790We recommend any interested parties make their own enquiries to Bath  and  North East Somerset Council (01225 477000) to verify these figures.Legal CostsEach party is to be responsible for their own legal and professional fees incurred in any transaction.Service Charge DetailsThe tenant will be expected to contribute to a fair and reasonable proportion of the landlord's costs in the upkeep, repair and maintenance of the building. Further details provided upon request.EPC TextPlease enquire with the agent for the precise asset rating.Further InformationViewings can be arranged through the joint agents,Allan LloydM 07527 388036E allan.lloyd@cs-re.co.ukNathan ClarkM 07983 460 230E nathan.clark@cs-re.co.ukEmily DaggM 07398 637345E emily.dagg@cs-re.co.uk( Agency Pilot Software ref: 708 )",https://propertylink.estatesgazette.com/property-details/6953158-4th-floor-cambridge-house-henry-street-bath-ba1-1jt,8th August 2024,51.37994,-2.357639
6948551,"Unit N4, Beehive Yard, Bath, Bath And North East Somerset, BA1 5BT","£12,000.00  Per  Annum",493.53 Sq Ft,"Office, Offices",CSquared (Previously Colston & Colston Chartered Surveyors),Emily Dagg,"The property comprises office / studio arranged on the first floor of a two-storey development. Internally, the space is open-plan, with a window to the front and rear. There are shared WC facilities on both first and ground floor. Externally, the property is rendered and painted, below a pitched tile roof.Bath is a city renowned for its attractive architecture, unique retail offering  and  world heritage status. Bath and North-East Somerset has a residential population of 193,400 and annual visitor numbers exceeding 6 million, according to the last Visitor Impact Report 2018. Bath is served by excellent transport infrastructure, junction 18 of the M4 being just 10 miles to the north via the A46. Train journeys to Bristol are just 12 minutes, with travel to London Paddington approximately 1 hour 20 minutes.The property is located at The Foundry, off Walcot Street and below 'The Tramshed', occupied by Neptune. Walcot Street links the City Centre toLondon Road, one of the main routes into the city, to the North and East. Nearby amenities include Waitrose, Landrace Bakery and The Fine Cheese Company. Local parking can be found at the Cattle Market car park and the Podium car parkThe property benefits from the following Net Internal Floor Areas:-Studio Floor 45.85 Sq M 493.53 Sq FtAll figures taken in accordance with the RICS Statement Property Measurement(2nd Ed), incorporating the RICS Code of Measuring Practice (6th Ed.).Rateable Value (April 2023) £3,900UBR (23/24) 0.499Rates Payable (23/24) £1,946Rates payable subject to small business rate relief eligibility.We recommend any interested parties make their own enquiries to Bath  and  North East Somerset Council (01225 477000) to verify these figures.Each party is to be responsible for their own legal and professional fees incurred in any transaction.66 CNathan ClarkEmily Dagg( Agency Pilot Software ref: 701 )",https://propertylink.estatesgazette.com/property-details/6948551-unit-n4-beehive-yard-bath-bath-and-north-east-somerset-ba1-5bt,4th September 2024,51.38605,-2.358995
