Id,Address,Price,Size,Property Type,Agency Name,Agent Name,Description,Property Link,Date Posted,Latitude,Longitude
6881244,"27 Upper Borough Walls, Bath, Bath And North East Somerset","£12,500.00 - £18,000.00  Per  Annum","729 - 1,566 Sq Ft","General Retail, Restaurants/Cafes, Retail, Licensed & Leisure",Carter Jonas LLP,Stuart Williams,"First  and  Basement Floors - Available to Let* Incentives Available *The premises front Upper Borough Walls with a return frontage to pedestrianised Union Passage which is where the self-contained entrance to the basement and first floor is located.The premises immediately adjoin Soho Coffee which fronts prime Union Street where multiples include Caffe Nero, Skechers and H Samuel Trade.Licenced Betting Office or uses within what was A1 (Retail), A2 (Financial Services) of the Town and Country Planning (Use Classes Order) 1987. The upper floors are permitted for uses within what was A1, A2, A3 and A5 or other uses subject to landlord's consent.The entire premises are assessed as C (58). ( Agency Pilot Software ref: 20012948 )",https://propertylink.estatesgazette.com/property-details/6881244-27-upper-borough-walls-bath-bath-and-north-east-somerset,1st October 2024,51.3825028,-2.360375
6962602,"6 Terrace Walk, Bath, Bath And North East Somerset, BA1 1LN","£25,000.00  Per  Annum","1,144 Sq Ft","Office, Retail - High Street, Other, Offices, Retail, Other Property Types & Opportunities",CSquared (Previously Colston & Colston Chartered Surveyors),Nathan Clark,"Situated on the first and second floors, the property overlooks Parade Gardens to the front and the Bath Abbey to the rear, the first and second-floor demise offers a well-presented space which is currently fitted out to be used as a cooking school, but would be suitable to a range of users, (within use class E). Inside, the property features large sash windows to both the front and rear of the property which allows excellent levels of natural light into the unit. 6 Terrace Walk features two w/c's situated on the second floor.Terrace Walk is a row of Georgian townhouses overlooking Parade Gardens in the center of Bath. Situated 350 meters from Bath Spa train station and 500 meters from both Southgate car park and Bath bus station. The premises are convenient to access via a range of transport options. A wide variety of food and beverage establishments can be found on the doorstep ( Agency Pilot Software ref: 623 )",https://propertylink.estatesgazette.com/property-details/6962602-6-terrace-walk-bath-bath-and-north-east-somerset-ba1-1ln,31st May 2024,51.381243,-2.357851
6975849,"Second Floor, 14 Queen Square, Bath, Bath and North East Somerset","£12,500.00  Per  Annum",683 Sq Ft,"Office, Offices",Carter Jonas LLP,Philip Marshall,"The property comprises a number of interconnecting offices all at second floor level. The office space benefits from shared WCs, showers and kitchen facilities.The property is situated on the western side of Queen Square in a prominent position on the corner within Bath city centre., next to Chapel Row. The offices are within a 15 minute walk of Bath Spa railway station, the Southgate Shopping Centre and a variety of restaurants, bars and amenities within the city centre.Bath is a UNESCO World Heritage City of international repute with an approximate population of 99,277 (ONS mid-year population estimates 2018). The city is a regional hub for retail and leisure and is one of the United Kingdom's most visited cities in terms of tourist numbers; with two universities and an established business community. Bath Spa train station has direct trains to both Bristol (circa 12 minutes) and London Paddington (circa 1 hour 30 minutes). Bath enjoys good road links to Bristol via the A4, the south coast via the A36 and the M4 Motorway (Junction 18).Prime city centreGrade I Listed Building( Agency Pilot Software ref: 20016161 )",https://propertylink.estatesgazette.com/property-details/6975849-second-floor-14-queen-square-bath-bath-and-north-east-somerset,19th August 2024,51.3830661,-2.3643166
6970383,"7 Kingsmead Square, Bath, Bath and North East Somerset","£52,000.00  Per  Annum","1,900 Sq Ft","Office, Offices",Carter Jonas LLP,Philip Marshall,"7 Kingsmead Square offers a rare chance to grow a business in a historic and revitalised top-to-bottom workspace located in an exciting part of Bath's city centre.The property has just been refurbished to a high specification and features new carpets and decoration, full data cabling, high performance window film, electric panel heating with optimised controller, LED lighting throughout, sound reducing floor system and new WC's and kitchen.Kingsmead Square is in the historic centre of Bath. The offices are within an impressive Georgian terrace that fills the south side of the Square, a beautiful amenity for you and your team, clients and visitors.With iconic sites, green spaces and the introduction of Bath's Clean Air Zone, there are many benefits to working and living in such a vibrant city.The current EPC is band C (52). ( Agency Pilot Software ref: 20016100 )",https://propertylink.estatesgazette.com/property-details/6970383-7-kingsmead-square-bath-bath-and-north-east-somerset,12th July 2024,51.3810553,-2.3632374
6984865,"Second Floor Front Suite, Redbridge House, Lower Bristol Road, Bath, Somerset","£29,500.00  Per  Annum","2,052 Sq Ft","Office, Offices",Carter Jonas LLP,Philip Marshall,"Part Open-Plan + Private OfficesThe building benefits from the following:- Passenger lift- New LED lighting- Suspended ceilings, gas central-heating, redecorated- Meeting/training room, fitted kitchen, new carpetsRedbridge House is approximately 2/3 of a mile west along the A36 Lower Bristol Road from Bath city centre.  It is on the corner with Midland Road; at the north end of which is the bridge, providing a link with the A4 Upper Bristol Road.The offices to let are in the front wing of the building, over the Kia-Ford garage's admin and showroom. Entrance is from the west side of the building to an inner hallway with staircase and lift to the upper floors.The offices have suspended ceilings with integral LED lighting, gas central-heating, and perimeter trunking. Men's, Ladies' and disabled WCs are off the 2nd floor landing area. There are plenty of windows to west and east.Part Open-Plan + Private Offices5 Car SpacesApprox 2/3rd mile west of city centre7 min. walk from Oldfield Park StationEnergy performance rated 85 in Band D.( Agency Pilot Software ref: 20016230 )",https://propertylink.estatesgazette.com/property-details/6984865-second-floor-front-suite-redbridge-house-lower-bristol-road-bath-somerset,15th October 2024,51.381776,-2.377124
6906299,"7 The Corridor, Bath, BA1 5AP",ROA,"1,763 Sq Ft","General Retail, Retail",Hartnell Taylor Cook LLP,Rebecca Harries,"Key PointsSituated within the Grade II listed CorridorNearby occupiers include Route One, Sofa.com, Society Cafe and Running Bath SportsClass E useSummaryArcade style shop to letDescriptionThe Corridor is a Grade II Listed building and the subject property offers significant retail facilities at ground floor level.LocationThe property is located in Bath's historic covered shopping arcade The Corridor which connects prime Union Street with High Street in the heart of the city centre. Tourist attractions in close proximity include Bath Abbey, Bath Spa and The Guildhall.Occupiers in the vicinity include Flock Clothing, Running Bath Sports, Society Cafe, Sofa.com and Route One.TermsThe property is available on a new effective full repairing and insuring lease for a terms of years to be agreed.Legal CostsEach party to be responsible for their own legal costs incurred in the transaction.RentOffers invited.",https://propertylink.estatesgazette.com/property-details/6906299-7-the-corridor-ba1,13th November 2024,51.382109,-2.3597827
6984798,"First Floor, 27A Westgate Street, Bath, BA1 1EP","£8,000.00   Per Annum",529 Sq Ft,"Office, Offices, Land, Commercial Land",James Armitage,James Armitage,"Grade II Listed Georgian buildingCity centre location529ft2 / 49.1m2FEATURES:South‐facing front officeRear office with kitchenetteExclusive WC on ground floorLOCATIONWestgate Street is located in the heart of Bath’s historic city centre. Originally forming the route to the west gate of the fourth century Roman settlement, it is now a vibrant shopping street which connects the Abbey and Roman Baths with Kingsmead Square. The train station is only a ten minute walk, with trains to London Paddington in under an hour and a half, and to Bristol in twenty minutes.DESCRIPTIONThe offices are located on the first floor of a grade II listed Georgian building and consist of two interconnected rooms totalling 529ft2 (49.1m2). A large front room features south‐facing sash windows above the street. A generous rear room faces into a courtyard and incorporates a kitchenette. The accommodation also includes an exclusive WC on the ground floor. Heating is by way of electric storage heaters.TENUREThe existing lease runs to April 2027 and would be assigned by the current tenant. Alternatively, a new lease may be negotiated with the landlord, Bath and North East Somerset Council.RENTThe current rent is £8,000 per annum.TERMSTenant internal repairing terms. The tenure is by way of service charge to proportionately contribute the landlord’s costs in maintaining and redecorating the common lobby, staircase and service facilities and insuring the building.RATESThe current rateable value is £9,100. Current Government policy is that you will not pay business rates on a property with a rateable value of £12,000 or less, if it is the only property your business uses. Interested parties are advised to make their own enquiries in this regard.LEGAL COSTSEach party to be responsible for the payment of their own legal fees incurred in the transaction.EPCThe office has an energy rating of C (67).Subject to Contract",https://propertylink.estatesgazette.com/property-details/6984798-first-floor-27a-westgate-street-bath-ba1-1ep,15th October 2024,51.3814822,-2.3617323
6680993,"No. 1 Bath Quays, Lower Bristol Road, Bath, BA2",ROA,"1,052 - 10,993 Sq Ft","Office, Offices",Knight Frank LLP,Andy Smith,"Outstanding  new Grade A office development in Bath. - No.1 Bath Quays is the first new office building in Bath for a generation and provides flexible configuration over five floors.The building provides a feature double height reception and the office accommodation is finished to a high specification including VRF air conditioning, suspended ceilings, LED lighting and raised access flooring.The building provides secure car parking spaces, including 2 electric car charging spaces, as well as secure cycle racks and dedicated male and female changing / shower facilities with secure lockers and a drying room.",https://propertylink.estatesgazette.com/property-details/6680993-no-1-bath-quays-lower-bristol-road-bath-ba2,29th April 2024,51.3781761,-2.363818
6990240,"2nd & 3rd Floors, Northgate House, Upper Borough Walls, Bath, United Kingdom BA1 1RG",ROA,"1 - 10,800 Sq Ft","Office, Serviced Office, Offices, Business park, Land, Retail, Commercial Land",IWG Plc,IWG PLC,"Being based in Bath gives your business the kudos of an historic, upmarket location among a range of very modern companies from engineering to IT. Indeed, Bath is home to five of the biggest 150 companies in the west of England, as well as small to medium sized businesses in IT, software, publishing and retail. It’s a great place to be if your company needs strong rail connections to London (about 1hr 30mins) or Bristol (just 20 minutes away) and by car Bath is 20 minutes from the M4.This makes a location in the heart of a designated UNESCO World Heritage site much sought-after, so this contemporary business centre in the conservation area is a real find. Northgate House is walking distance from the station and includes attractive offices, meeting rooms and co-working space (with business Wi-Fi), all newly refurbished. They offer attractive views of the historic city. Plus, talent graduating from the University of Bath and City of Bath College will give you a competitive advantage.At Spaces Northgate House, we can support with:• Office Space: Your own private and fully serviced office space with a flexible contract that adapts to your business and is accessible 24/7.• Coworking Membership: Work from thousands of coworking spaces worldwide, all with a flexible contract and unlimited access during business hours.• Dedicated Desk: Your own private desk in a shared office or open plan space that can be accessed 24/7, locker included, all with a flexible contract.• Meeting Rooms: Choose from thousands of on-demand meeting rooms and event spaces with all the services you need, fully customisable to any event or duration.• Virtual Office: Leave the best impression with a professional business address at one of our locations and have us handle your calls and mail.Just so you know; all images shown in this listing are from Spaces locations, but they may not correspond to this specific one.Get in touch",https://propertylink.estatesgazette.com/property-details/6990240-we-offer-workspace-options-fully-tailored-to-your-needs-in-spaces-northgate-house,13th November 2024,51.3826169,-2.3595445
6761741,"Royal Mead , 4-5 Railway Place, City Centre, Bath, South West, BA1",£36.00 - £40.00   Per Sq Ft,"4,092 - 25,451 Sq Ft","Office, Offices",Lambert Smith Hampton - Bristol ,Roxine Foster,"Royal Mead is being comprehensively remodeled to provide exceptional accommodation with a contemporary feel. Royal Mead will benefit from a new glazed reception, new lifts, new toilet accommodation and new showers together with lockers, drying room and extensive cycle storage. The office floors will be comprehensively refurbished with new air conditioning throughout, new suspended ceilings and new LED lighting together with full access raised floors.( Agency Pilot Software ref: 2018995 )",https://propertylink.estatesgazette.com/property-details/6761741-royal-mead-4-5-railway-place-city-centre-bath-south-west-ba1,27th August 2024,51.3778,-2.355498
6778007,"A/B &amp; Grd C/D Crescent Office Park, Clarks Way, Bath, BA2 2AF",ROA,"2,400 - 7,200 Sq Ft","Office, Offices",Colliers ,James Preece,"Modern air conditioned offices with views over Bath and the surrounding area.EPC RatingC (58)Description-Air conditioning-Suspended ceilings-LG7 lighting-Perimeter trunking-Kitchenette-Male, female and disabled WC’sLocationBath is a world heritage site in the county of Somerset, 97 miles west of London and 11 miles south-east of Bristol.Crescent Office Park is located adjacent to the A367, 2 miles from the city centre on the southern outskirts. The property benefits from being 1.6 miles from Bath Railway Station and just 1.2 miles from Oldfield Park Station.AccommodationA/B Ground Floor - 2,400 sq ft (223 sq m)A/B First Floor - 2,400 sq ft (223 sq m)C/D Ground Floor - 2,400 sq ft (223 sq m)Car Parking27 on site car parking spaces, equivalent to a ratio of 1:267 sq ftTermsThe offices are available as a whole or on a floor by floor basis, by way of a new full repairing and insuring lease for a term to be agreed.Rental / PriceUpon application.Legal CostsEach party will be responsible for their own legal costs.Business RatesInterested parties should make their own enquiries.Service ChargeIf the property is let on a floor by floor basis, a service charge will be levied to cover the cost of the common services.VATAll figures quoted are exclusive of VAT where applicable.ViewingStrictly by prior appointment through sole agents Colliers.",https://propertylink.estatesgazette.com/property-details/6778007-a-b-amp-grd-c-d-crescent-office-park-clarks-way-bath-ba2-2af,1st July 2022,51.3622856,-2.3866287
6906944,"The Corridor, Bath, Bath And North East Somerset, BA1","£40,000.00  Per  Annum","1,763 Sq Ft","General Retail, Restaurants/Cafes, Retail, Licensed & Leisure",Carter Jonas LLP,Tim Brooksbank,Class 'E' Retail Unit to LetThe Grade II Listed property is arranged over ground floor and basement: there is a mezzanine kitchen/ancillary area. The mezzanine floor provides open plan sales. The first floor is accessed via a spiral staircase and provides kitchen and W/C facilities. The basement provides additional ancillary accommodation. ( Agency Pilot Software ref: 20014099 ),https://propertylink.estatesgazette.com/property-details/6906944-the-corridor-bath-bath-and-north-east-somerset-ba1,9th October 2024,51.382109,-2.3597827
6923560,"Upper Floors , 39 Gay Street, Bath, Bath And North East Somerset, BA1 2NT","£10,000.00 - £23,500.00  Per  Annum",436 Sq Ft,"Office, Offices",CSquared (Previously Colston & Colston Chartered Surveyors),Maddie Pyles,"Gay Street is part of Bath's long standing economic centre and runs parallel to Milsom Street. Surrounding occupiers include construction consultants, financial institutions, law firms, cafes, restaurants and bars. Nearby car parking can be found at Charlotte Street Car Park, less than 350 metres west. Bath Spa train station and Bath bus station are a 15-minute walk to the south.The Grade II Listed building forms part of a mid-terraced Georgian townhouse constructed of Bath ashlar stone. Each floor provides interlinked offices providing the flexibility for an occupier to have private meeting rooms / offices. Sash windows placed to the front of the property and to the rear provide excellent levels of natural light to all floors. A single W/C is provided off the landing for the benefit of the suites.First, second and third floor office available together or separately. Attractive Rent-Free Period Available, Subject to Terms.The property benefits from the following Net Internal Floor Areas:- 1,225 sqftRates payable subject to small business rate relief eligibility.We recommend any interested parties make their own enquiries to Bath  and  North East Somerset Council (01225 477000) to verify these figures.Viewings can be arranged through the sole agents at CSquared. ( Agency Pilot Software ref: 339 )",https://propertylink.estatesgazette.com/property-details/6923560-upper-floors-39-gay-street-bath-bath-and-north-east-somerset-ba1-2nt,12th August 2024,51.3841127,-2.3631466
6898832,"Bath Street, Bath, Bath And North East Somerset, BA1",ROA,"5,381 Sq Ft","Office, General Retail, Restaurants/Cafes, Offices, Retail, Licensed & Leisure",Carter Jonas LLP,Tim Brooksbank,"LEASE ASSIGNMENT - Retail Unit 'E' UseThis Grade I Listed property comprises ground, first and basement floor sales and benefit from an attractive and prominent frontage onto Bath Street.The colonnades provide for al fresco dining along with additional seating (STP) on Bath Street. The recently refurbished property has a new staircase from basement level to first floor allowing an occupier to utilise all floors as sales. The property also benefits from an alcohol licence.The property is currently occupied by Fly Fitness who are looking to assign their Lease.  ( Agency Pilot Software ref: 20013056 )",https://propertylink.estatesgazette.com/property-details/6898832-bath-street-bath-bath-and-north-east-somerset-ba1,22nd April 2024,51.3807307,-2.3606197
6692883,"Newark Works, Lower Bristol Road, Bath, Somerset, BA2",ROA,"244 - 4,841 Sq Ft","Office, Offices",CSquared (Previously Colston & Colston Chartered Surveyors),Allan Lloyd,"Newark Works is the only remaining 19th century works of the highly significant engineering firm, Stothert  and  Pitt.The development will retain much of the character of the building; set to provide unique and iconic industrial style workspaces.The huge halls and high ceilings, exposed brickwork and industrial steel, combine to provide a dramatic working environment, to provide a creative hub for forward thinkers, thought leaders and entrepreneurs.It is a dynamic and vibrant destination at the heart of the fast-evolving Bath Quays business district, within the new Bath Enterprise Zone. This is a home for single entrepreneurs, burgeoning creative businesses and well-established companies alike.Follow the link for a 3D walk through of the development and to see the available space: https://my.matterport.com/show/?m=ENDC35tpzKABath is a city which offers both the traditional and contemporary. Steeped in history and surrounded by world heritage architecture, Bath is home to many cultural events, such as literary and live music festivals as well as bustling shopping streets and beautiful countryside.Prominently positioned on the riverfront, Bath Quays sits within the Bath World Heritage Site and is a 4.5 acre game-changing development. The city's dramatic new riverside district for business, recreation  and  culture.A blend of historic buildings with contemporary architecture on both north and south sides of the river, offering a total of circa 340,000 sq ft of office space.Benefitting from a new foot bridge across the river, Newark Works and Bath Quays are only 5 minutes' walk from the city centre, train station and the city's outstanding retail, food and leisure offer.TCN's redevelopment of this historic, Grade-II listed, industrial building, signifies the rebirth of Newark Works and future collaborations across 40,000 sq ft of workspaces.It is a dynamic and vibrant destination at the heart of the fast-evolving Bath Quays business district, within the new Bath Enterprise Zone. This is a home for single entrepreneurs, burgeoning creative businesses and well-established companies alike. ( Agency Pilot Software ref: 434 )",https://propertylink.estatesgazette.com/property-details/6692883-newark-works-lower-bristol-road-bath-somerset-ba2,7th October 2024,51.3781761,-2.363818
6977992,"Cambridge House, 1-4 Cambridge House, Henry Street, Bath, BA1 1JS",ROA,"5,500 - 11,724 Sq Ft","Office, Offices",Hartnell Taylor Cook LLP,Chris Grazier,"Key PointsCentral Bath locationOpen plan office accommodationRaised carpets and suspended ceilingsImmediately adjacent to Southgate Shopping CentreSummaryPrime office accommodation in a central Bath locationDescriptionCambridge House comprises a retail unit on the ground floor with 5 floors of high quality office accommodation above. The fourth floor provides an open plan office, benefiting from suspended ceilings, raised floors, air conditioning, LG7 lighting, fully fitted kitchen with social space, WCs and shower facilities.LocationBath is a historic, vibrant city and designated UNESCO World Heritage Site. Bath City Centre is one of the UK’s top tourist destinations in the UK with attractions such as the Roman Bath and Bath's famous architecture and archaeology.Bath benefits from excellent road communications situated 8 miles south of the M4 motorway and 20 miles east of the M5 motorway. There is a direct rail service from Bath Spa to London Paddington at regular intervals with the fastest journey time of 1 hour 25 minutes. There are regular direct trains to Bristol Temple Meads Railway Station, and an approximate journey time of 12 minutes.Cambridge House is situated on Henry Street, a short 4-minute walk to Bath Spa Train Station (0.2 miles) and Bath’s primary Bus Station. The property is closely located to the primary retailing pitch of Stall Street and Union Street. The property is also situated a short walk from the SouthGate Shopping Centre, Bath’s primary shopping centre.Availability_textThe accommodation comprises the following areas:",https://propertylink.estatesgazette.com/property-details/6977992-cambridge-house-1-4-cambridge-house-ba1,4th September 2024,51.379533,-2.358268
6870350,"Ground Floor, 14 Queen Square, Bath, Bath And North East Somerset","£29,500.00  Per  Annum","1,298 Sq Ft","Office, Offices",Carter Jonas LLP,Maddie Pyles,"Prime Bath City Centre Offices - To LetThe property comprises a number of interconnecting offices all at ground floor level, The office space benefits from shared WCs, showers and kitchen facilities.The property is situated on the western side of Queen Square in a prominent position on the corner within Bath city centre, next to Chapel Row. The offices are within a 15 minute walk of Bath Spa railway station, the Southgate Shopping Centre and a variety of restaurants, bars and amenities within the city centre.Bath is a UNESCO World Heritage City of international repute with an approximate population of 99,277 (ONS mid-year population estimates 2018). The city is a regional hub for retail and leisure and is one of the United Kingdom's most visited cities in terms of tourist numbers; with two universities and an established business community.Bath Spa train station has direct trains to both Bristol (circa 12 minutes) and London Paddington (circa 1 hour 30 minutes). Bath enjoys good road links to Bristol via the A4, the south coast via the A36 and the M4 Motorway (Junction 18).Prime City Centre LocationGrade I Listed ( Agency Pilot Software ref: 20012860 )",https://propertylink.estatesgazette.com/property-details/6870350-ground-floor-14-queen-square-bath-bath-and-north-east-somerset,11th April 2024,51.3830661,-2.3643166
